<?xml version="1.0" encoding="UTF-8" standalone="no"?>
<!DOCTYPE beans PUBLIC "-//sparrow Framework//DTD ioc Configuration//EN"
        "beans.dtd">
<beans>
    <component-scan>com.sparrow</component-scan>
    <!---当前进程的所有datasource实例-->
    <bean name="dataSourceFactory" class="com.sparrow.orm.datasource.DataSourceFactoryImpl">
        <constructor-arg index="1" name="initDatasourceKeys" value="sparrow_default" type="string"/>
    </bean>

    <bean name="connectionContextHolder" class="com.sparrow.orm.transaction.ConnectionContextHolderImpl">
        <property name="dataSourceFactory" ref="dataSourceFactory"/>
    </bean>

    <bean name="poolConfig" class="redis.clients.jedis.JedisPoolConfig">
        <property name="maxActive" value="${redis.pool.maxActive}"/>
        <property name="maxIdle" value="${redis.pool.maxIdle}"/>
        <property name="maxWait" value="${redis.pool.maxWait}"/>
        <property name="minIdle" value="${redis.pool.minIdle}"/>
        <property name="testOnBorrow" value="${redis.pool.testOnBorrow}"/>
        <property name="timeBetweenEvictionRunsMillis" value="${redis.pool.timeBetweenEvictionRunsMillis}"/>
        <property name="minEvictableIdleTimeMillis" value="${redis.pool.minEvictableIdleTimeMillis}"/>
    </bean>

    <bean name="redisPool" class="com.sparrow.cache.impl.redis.jedis.RedisPool">
        <property name="urls" value="${redis_url}"/>
        <property name="config" ref="poolConfig"/>
    </bean>


    <bean name="sparrow_default" class="com.sparrow.datasource.ConnectionPool">
        <property name="dataSourceFactory" ref="dataSourceFactory"/>
    </bean>

    <bean name="sparrowServletUtility" class="com.sparrow.utility.web.SparrowServletUtility"/>
    <bean name="authenticatorService" class="com.sparrow.authorizing.AuthenticatorDemo"/>
    <bean name="authorizerService" class="com.sparrow.authorizing.AuthorizerDemo"/>

    <bean name="helloController" class="com.sparrow.controller.HelloController" controller="true">
        <property name="authenticatorService" ref="authenticatorService"/>
        <property name="servletContainer" ref="sparrowServletContainer"/>
    </bean>
    <bean name="elasticSearchController" class="com.sparrow.controller.ElasticSearchController" controller="true"/>
    <bean name="classLoaderController" class="com.sparrow.controller.ClassLoaderController" controller="true"/>
</beans>
